{
  "apiVersion": "hosting.lowerduckpond.net/v1alpha1",
  "kind": "AuthorizationJob",
  "compatibilityVersion": "static-job-v1",
  "jobId": "0198d17f-6f4a-7000-8000-000000000002",
  "operatorPrincipal": "operator@example.test",
  "request": {
    "apiVersion": "hosting.lowerduckpond.net/v1alpha1",
    "kind": "OperationRequest",
    "operation": "create",
    "correlationId": "0198d17f-6f4a-7000-8000-000000000001",
    "slug": "duck-repair",
    "quotas": {
      "storageMiB": 100,
      "entries": 5000
    }
  },
  "requestDigest": {
    "format": "lowerduckpond-request-v1",
    "algorithm": "sha256",
    "value": "eeeeeeeeeeeeeeeeeeeeeeeeeeeeeeeeeeeeeeeeeeeeeeeeeeeeeeeeeeeeeeee"
  },
  "artifact": null,
  "expectedSource": {
    "expectsTenantAbsent": true,
    "lifecycle": null,
    "manifestDigest": null,
    "deploymentDigest": null,
    "archiveRecordDigest": null,
    "platformStateDigest": {
      "format": "lowerduckpond-platform-state-v1",
      "algorithm": "sha256",
      "value": "ffffffffffffffffffffffffffffffffffffffffffffffffffffffffffffffff"
    }
  },
  "acceptedAt": "2026-08-29T12:00:01Z",
  "phase": "pending"
}
